[I 2025-07-16 17:21:12,219] A new study created in memory with name: no-name-b7aca357-cf09-4bd9-ba83-c0b6c4e37d3d
cuda
Let's use 2 GPUs!
Epoch number:  0
0
1
2
3
4
5
6
7
8
9
10
11
12
13
14
15
16
17
18
19
20
21
22
23
24
25
26
27
28
29
30
31
32
33
34
35
36
37
38
39
40
41
42
43
44
45
46
47
48
Epoch number:  1
0
1
2
3
4
5
6
7
8
9
10
11
12
13
14
15
16
17
18
19
20
21
22
23
24
25
26
27
28
29
30
31
32
33
34
35
36
37
38
39
40
41
42
43
44
45
46
47
48
Epoch number:  2
0
1
2
3
4
5
6
7
8
9
10
11
12
13
14
15
16
17
18
19
20
21
22
23
24
25
26
27
28
29
30
31
32
33
34
35
36
37
38
39
40
41
42
43
44
45
46
47
48
Epoch number:  3
0
1
2
3
4
5
6
7
8
9
10
11
12
13
14
15
16
17
18
19
20
21
22
23
24
25
26
27
28
29
30
31
32
33
34
35
36
37
38
39
40
41
42
43
44
45
46
47
48
Epoch number:  4
0
1
2
3
4
5
6
7
8
9
10
11
12
13
14
15
16
17
18
19
20
21
22
23
24
25
26
27
28
29
30
31
32
33
34
35
36
37
38
39
40
41
42
43
44
45
46
47
48
[I 2025-07-16 17:25:40,761] Trial 0 finished with value: 0.03879472693032015 and parameters: {'lr': 3.0541928142400126e-05, 'weight_decay': 8.227981771968271e-05, 'optimizer': 'Adam', 'batch_size': 128}. Best is trial 0 with value: 0.03879472693032015.
Let's use 2 GPUs!
Epoch number:  0
0
1
2
3
4
5
6
7
8
9
10
11
12
13
14
15
16
17
18
19
20
21
22
23
24
25
26
27
28
29
30
31
32
33
34
35
36
37
38
39
40
41
42
43
44
45
46
47
48
Epoch number:  1
0
1
2
3
4
5
6
7
8
9
10
11
12
13
14
15
16
17
18
19
20
21
22
23
24
25
26
27
28
29
30
31
32
33
34
35
36
37
38
39
40
41
42
43
44
45
46
47
48
Epoch number:  2
0
1
2
3
4
5
6
7
8
9
10
11
12
13
14
15
16
17
18
19
20
21
22
23
24
25
26
27
28
29
30
31
32
33
34
35
36
37
38
39
40
41
42
43
44
45
46
47
48
Epoch number:  3
0
1
2
3
4
5
6
7
8
9
10
11
12
13
14
15
16
17
18
19
20
21
22
23
24
25
26
27
28
29
30
31
32
33
34
35
36
37
38
39
40
41
42
43
44
45
46
47
48
Epoch number:  4
0
1
2
3
4
5
6
7
8
9
10
11
12
13
14
15
16
17
18
19
20
21
22
23
24
25
26
27
28
29
30
31
32
33
34
35
36
37
38
39
40
41
42
43
44
45
46
47
48
[I 2025-07-16 17:30:03,825] Trial 1 finished with value: 0.0018832391713747645 and parameters: {'lr': 1.0318286505873125e-05, 'weight_decay': 0.00304050894794293, 'optimizer': 'SGD', 'batch_size': 128}. Best is trial 0 with value: 0.03879472693032015.
Let's use 2 GPUs!
Epoch number:  0
0
1
2
3
4
5
6
7
8
9
10
11
12
13
14
15
16
17
18
19
20
21
22
23
24
25
26
27
28
29
30
31
32
33
34
35
36
37
38
39
40
41
42
43
44
45
46
47
48
Epoch number:  1
0
1
2
3
4
5
6
7
8
9
10
11
12
13
14
15
16
17
18
19
20
21
22
23
24
25
26
27
28
29
30
31
32
33
34
35
36
37
38
39
40
41
42
43
44
45
46
47
48
Epoch number:  2
0
1
2
3
4
5
6
7
8
9
10
11
12
13
14
15
16
17
18
19
20
21
22
23
24
25
26
27
28
29
30
31
32
33
34
35
36
37
38
39
40
41
42
43
44
45
46
47
48
Epoch number:  3
0
1
2
3
4
5
6
7
8
9
10
11
12
13
14
15
16
17
18
19
20
21
22
23
24
25
26
27
28
29
30
31
32
33
34
35
36
37
38
39
40
41
42
43
44
45
46
47
48
Epoch number:  4
0
1
2
3
4
5
6
7
8
9
10
11
12
13
14
15
16
17
18
19
20
21
22
23
24
25
26
27
28
29
30
31
32
33
34
35
36
37
38
39
40
41
42
43
44
45
46
47
48
[I 2025-07-16 17:34:24,143] Trial 2 finished with value: 0.0030131826741996233 and parameters: {'lr': 0.000314721270840478, 'weight_decay': 0.008406849398293635, 'optimizer': 'SGD', 'batch_size': 128}. Best is trial 0 with value: 0.03879472693032015.
Let's use 2 GPUs!
Epoch number:  0
0
1
2
3
4
5
6
7
8
9
10
11
12
13
14
15
16
17
18
19
20
21
22
23
24
Epoch number:  1
0
1
2
3
4
5
6
7
8
9
10
11
12
13
14
15
16
17
18
19
20
21
22
23
24
Epoch number:  2
0
1
2
3
4
5
6
7
8
9
10
11
12
13
14
15
16
17
18
19
20
21
22
23
24
Epoch number:  3
0
1
2
3
4
5
6
7
8
9
10
11
12
13
14
15
16
17
18
19
20
21
22
23
24
Epoch number:  4
0
1
2
3
4
5
6
7
8
9
10
11
12
13
14
15
16
17
18
19
20
21
22
23
24
[I 2025-07-16 17:38:43,548] Trial 3 finished with value: 0.01807909604519774 and parameters: {'lr': 2.916484917466236e-05, 'weight_decay': 0.0008795445356623619, 'optimizer': 'Adam', 'batch_size': 256}. Best is trial 0 with value: 0.03879472693032015.
Let's use 2 GPUs!
Epoch number:  0
0
1
2
3
4
5
6
7
8
9
10
11
12
13
14
15
16
17
18
19
20
21
22
23
24
Epoch number:  1
0
1
2
3
4
5
6
7
8
9
10
11
12
13
14
15
16
17
18
19
20
21
22
23
24
Epoch number:  2
0
1
2
3
4
5
6
7
8
9
10
11
12
13
14
15
16
17
18
19
20
21
22
23
24
Epoch number:  3
0
1
2
3
4
5
6
7
8
9
10
11
12
13
14
15
16
17
18
19
20
21
22
23
24
Epoch number:  4
0
1
2
3
4
5
6
7
8
9
10
11
12
13
14
15
16
17
18
19
20
21
22
23
24
[I 2025-07-16 17:43:06,912] Trial 4 finished with value: 0.0026365348399246705 and parameters: {'lr': 0.0013134529040298559, 'weight_decay': 0.005458673666944891, 'optimizer': 'SGD', 'batch_size': 256}. Best is trial 0 with value: 0.03879472693032015.
Let's use 2 GPUs!
Epoch number:  0
0
1
2
3
4
5
6
7
8
9
10
11
12
13
14
15
16
17
18
19
20
21
22
23
24
25
26
27
28
29
30
31
32
33
34
35
36
37
38
39
40
41
42
43
44
45
46
47
48
49
50
51
52
53
54
55
56
57
58
59
60
61
62
63
64
65
66
67
68
69
70
71
72
73
74
75
76
77
78
79
80
81
82
83
84
85
86
87
88
89
90
91
92
93
94
95
96
97
98
99
100
101
102
103
104
105
106
107
108
109
110
111
112
113
114
115
116
117
118
119
120
121
122
123
124
125
126
127
128
129
130
131
132
133
134
135
136
137
138
139
140
141
142
143
144
145
146
147
148
149
150
151
152
153
154
155
156
157
158
159
160
161
162
163
164
165
166
167
168
169
170
171
172
173
174
175
176
177
178
179
180
181
182
183
184
185
186
187
188
189
190
191
192
193
Epoch number:  1
0
1
2
3
4
5
6
7
8
9
10
11
12
13
14
15
16
17
18
19
20
21
22
23
24
25
26
27
28
29
30
31
32
33
34
35
36
37
38
39
40
41
42
43
44
45
46
47
48
49
50
51
52
53
54
55
56
57
58
59
60
61
62
63
64
65
66
67
68
69
70
71
72
73
74
75
76
77
78
79
80
81
82
83
84
85
86
87
88
89
90
91
92
93
94
95
96
97
98
99
100
101
102
103
104
105
106
107
108
109
110
111
112
113
114
115
116
117
118
119
120
121
122
123
124
125
126
127
128
129
130
131
132
133
134
135
136
137
138
139
140
141
142
143
144
145
146
147
148
149
150
151
152
153
154
155
156
157
158
159
160
161
162
163
164
165
166
167
168
169
170
171
172
173
174
175
176
177
178
179
180
181
182
183
184
185
186
187
188
189
190
191
192
193
Epoch number:  2
0
1
2
3
4
5
6
7
8
9
10
11
12
13
14
15
16
17
18
19
20
21
22
23
24
25
26
27
28
29
30
31
32
33
34
35
36
37
38
39
40
41
42
43
44
45
46
47
48
49
50
51
52
53
54
55
56
57
58
59
60
61
62
63
64
65
66
67
68
69
70
71
72
73
74
75
76
77
78
79
80
81
82
83
84
85
86
87
88
89
90
91
92
93
94
95
96
97
98
99
100
101
102
103
104
105
106
107
108
109
110
111
112
113
114
115
116
117
118
119
120
121
122
123
124
125
126
127
128
129
130
131
132
133
134
135
136
137
138
139
140
141
142
143
144
145
146
147
148
149
150
151
152
153
154
155
156
157
158
159
160
161
162
163
164
165
166
167
168
169
170
171
172
173
174
175
176
177
178
179
180
181
182
183
184
185
186
187
188
189
190
191
192
193
Epoch number:  3
0
1
2
3
4
5
6
7
8
9
10
11
12
13
14
15
16
17
18
19
20
21
22
23
24
25
26
27
28
29
30
31
32
33
34
35
36
37
38
39
40
41
42
43
44
45
46
47
48
49
50
51
52
53
54
55
56
57
58
59
60
61
62
63
64
65
66
67
68
69
70
71
72
73
74
75
76
77
78
79
80
81
82
83
84
85
86
87
88
89
90
91
92
93
94
95
96
97
98
99
100
101
102
103
104
105
106
107
108
109
110
111
112
113
114
115
116
117
118
119
120
121
122
123
124
125
126
127
128
129
130
131
132
133
134
135
136
137
138
139
140
141
142
143
144
145
146
147
148
149
150
151
152
153
154
155
156
157
158
159
160
161
162
163
164
165
166
167
168
169
170
171
172
173
174
175
176
177
178
179
180
181
182
183
184
185
186
187
188
189
190
191
192
193
Epoch number:  4
0
1
2
3
4
5
6
7
8
9
10
11
12
13
14
15
16
17
18
19
20
21
22
23
24
25
26
27
28
29
30
31
32
33
34
35
36
37
38
39
40
41
42
43
44
45
46
47
48
49
50
51
52
53
54
55
56
57
58
59
60
61
62
63
64
65
66
67
68
69
70
71
72
73
74
75
76
77
78
79
80
81
82
83
84
85
86
87
88
89
90
91
92
93
94
95
96
97
98
99
100
101
102
103
104
105
106
107
108
109
110
111
112
113
114
115
116
117
118
119
120
121
122
123
124
125
126
127
128
129
130
131
132
133
134
135
136
137
138
139
140
141
142
143
144
145
146
147
148
149
150
151
152
153
154
155
156
157
158
159
160
161
162
163
164
165
166
167
168
169
170
171
172
173
174
175
176
177
178
179
180
181
182
183
184
185
186
187
188
189
190
191
192
193
[I 2025-07-16 17:48:05,543] Trial 5 finished with value: 0.005273069679849341 and parameters: {'lr': 0.006492917947212715, 'weight_decay': 1.858055333353741e-05, 'optimizer': 'SGD', 'batch_size': 32}. Best is trial 0 with value: 0.03879472693032015.
Let's use 2 GPUs!
Epoch number:  0
0
1
2
3
4
5
6
7
8
9
10
11
12
13
14
15
16
17
18
19
20
21
22
23
24
25
26
27
28
29
30
31
32
33
34
35
36
37
38
39
40
41
42
43
44
45
46
47
48
49
50
51
52
53
54
55
56
57
58
59
60
61
62
63
64
65
66
67
68
69
70
71
72
73
74
75
76
77
78
79
80
81
82
83
84
85
86
87
88
89
90
91
92
93
94
95
96
Epoch number:  1
0
1
2
3
4
5
6
7
8
9
10
11
12
13
14
15
16
17
18
19
20
21
22
23
24
25
26
27
28
29
30
31
32
33
34
35
36
37
38
39
40
41
42
43
44
45
46
47
48
49
50
51
52
53
54
55
56
57
58
59
60
61
62
63
64
65
66
67
68
69
70
71
72
73
74
75
76
77
78
79
80
81
82
83
84
85
86
87
88
89
90
91
92
93
94
95
96
[I 2025-07-16 17:49:56,259] Trial 6 pruned. 
Let's use 2 GPUs!
Epoch number:  0
0
1
2
3
4
5
6
7
8
9
10
11
12
13
14
15
16
17
18
19
20
21
22
23
24
25
26
27
28
29
30
31
32
33
34
35
36
37
38
39
40
41
42
43
44
45
46
47
48
Epoch number:  1
0
1
2
3
4
5
6
7
8
9
10
11
12
13
14
15
16
17
18
19
20
21
22
23
24
25
26
27
28
29
30
31
32
33
34
35
36
37
38
39
40
41
42
43
44
45
46
47
48
Epoch number:  2
0
1
2
3
4
5
6
7
8
9
10
11
12
13
14
15
16
17
18
19
20
21
22
23
24
25
26
27
28
29
30
31
32
33
34
35
36
37
38
39
40
41
42
43
44
45
46
47
48
Epoch number:  3
0
1
2
3
4
5
6
7
8
9
10
11
12
13
14
15
16
17
18
19
20
21
22
23
24
25
26
27
28
29
30
31
32
33
34
35
36
37
38
39
40
41
42
43
44
45
46
47
48
Epoch number:  4
0
1
2
3
4
5
6
7
8
9
10
11
12
13
14
15
16
17
18
19
20
21
22
23
24
25
26
27
28
29
30
31
32
33
34
35
36
37
38
39
40
41
42
43
44
45
46
47
48
[I 2025-07-16 17:54:24,427] Trial 7 finished with value: 0.022222222222222223 and parameters: {'lr': 2.1748646553991592e-05, 'weight_decay': 0.0002900910029880365, 'optimizer': 'Adam', 'batch_size': 128}. Best is trial 0 with value: 0.03879472693032015.
Let's use 2 GPUs!
Epoch number:  0
0
1
2
3
4
5
6
7
8
9
10
11
12
13
14
15
16
17
18
19
20
21
22
23
24
Epoch number:  1
0
1
2
3
4
5
6
7
8
9
10
11
12
13
14
15
16
17
18
19
20
21
22
23
24
Epoch number:  2
0
1
2
3
4
5
6
7
8
9
10
11
12
13
14
15
16
17
18
19
20
21
22
23
24
Epoch number:  3
0
1
2
3
4
5
6
7
8
9
10
11
12
13
14
15
16
17
18
19
20
21
22
23
24
Epoch number:  4
0
1
2
3
4
5
6
7
8
9
10
11
12
13
14
15
16
17
18
19
20
21
22
23
24
[I 2025-07-16 17:58:52,532] Trial 8 finished with value: 0.0030131826741996233 and parameters: {'lr': 0.0015541818905563942, 'weight_decay': 7.00695029797005e-05, 'optimizer': 'Adam', 'batch_size': 256}. Best is trial 0 with value: 0.03879472693032015.
Let's use 2 GPUs!
Epoch number:  0
0
1
2
3
4
5
6
7
8
9
10
11
12
13
14
15
16
17
18
19
20
21
22
23
24
Epoch number:  1
0
1
2
3
4
5
6
7
8
9
10
11
12
13
14
15
16
17
18
19
20
21
22
23
24
[I 2025-07-16 18:00:50,359] Trial 9 pruned. 
Let's use 2 GPUs!
Epoch number:  0
0
1
2
3
4
5
6
7
8
9
10
11
12
Epoch number:  1
0
1
2
3
4
5
6
7
8
9
10
11
12
Epoch number:  2
0
1
2
3
4
5
6
7
8
9
10
11
12
Epoch number:  3
0
1
2
3
4
5
6
7
8
9
10
11
12
Epoch number:  4
0
1
2
3
4
5
6
7
8
9
10
11
12
[I 2025-07-16 18:05:21,147] Trial 10 finished with value: 0.046704331450094165 and parameters: {'lr': 7.643059653538898e-05, 'weight_decay': 1.4798611235432627e-06, 'optimizer': 'Adam', 'batch_size': 512}. Best is trial 10 with value: 0.046704331450094165.
Let's use 2 GPUs!
Epoch number:  0
0
1
2
3
4
5
6
7
8
9
10
11
12
Epoch number:  1
0
1
2
3
4
5
6
7
8
9
10
11
12
Epoch number:  2
0
1
2
3
4
5
6
7
8
9
10
11
12
Epoch number:  3
0
1
2
3
4
5
6
7
8
9
10
11
12
Epoch number:  4
0
1
2
3
4
5
6
7
8
9
10
11
12
[I 2025-07-16 18:09:40,766] Trial 11 finished with value: 0.051224105461393596 and parameters: {'lr': 8.629353717306109e-05, 'weight_decay': 1.0004618180399441e-06, 'optimizer': 'Adam', 'batch_size': 512}. Best is trial 11 with value: 0.051224105461393596.
Let's use 2 GPUs!
Epoch number:  0
0
1
2
3
4
5
6
7
8
9
10
11
12
Epoch number:  1
0
1
2
3
4
5
6
7
8
9
10
11
12
Epoch number:  2
0
1
2
3
4
5
6
7
8
9
10
11
12
Epoch number:  3
0
1
2
3
4
5
6
7
8
9
10
11
12
Epoch number:  4
0
1
2
3
4
5
6
7
8
9
10
11
12
[I 2025-07-16 18:14:00,581] Trial 12 finished with value: 0.06516007532956686 and parameters: {'lr': 0.0001012756814626916, 'weight_decay': 1.075942214819337e-06, 'optimizer': 'Adam', 'batch_size': 512}. Best is trial 12 with value: 0.06516007532956686.
Let's use 2 GPUs!
Epoch number:  0
0
1
2
3
4
5
6
7
8
9
10
11
12
Epoch number:  1
0
1
2
3
4
5
6
7
8
9
10
11
12
Epoch number:  2
0
1
2
3
4
5
6
7
8
9
10
11
12
Epoch number:  3
0
1
2
3
4
5
6
7
8
9
10
11
12
Epoch number:  4
0
1
2
3
4
5
6
7
8
9
10
11
12
[I 2025-07-16 18:18:20,620] Trial 13 finished with value: 0.050094161958568736 and parameters: {'lr': 9.2476253586317e-05, 'weight_decay': 1.4083587858582265e-06, 'optimizer': 'Adam', 'batch_size': 512}. Best is trial 12 with value: 0.06516007532956686.
Let's use 2 GPUs!
Epoch number:  0
0
1
2
3
4
5
6
7
8
9
10
11
12
Epoch number:  1
0
1
2
3
4
5
6
7
8
9
10
11
12
Epoch number:  2
0
1
2
3
4
5
6
7
8
9
10
11
12
Epoch number:  3
0
1
2
3
4
5
6
7
8
9
10
11
12
Epoch number:  4
0
1
2
3
4
5
6
7
8
9
10
11
12
[I 2025-07-16 18:22:40,767] Trial 14 finished with value: 0.05084745762711865 and parameters: {'lr': 8.432671947897079e-05, 'weight_decay': 5.818407470400491e-06, 'optimizer': 'Adam', 'batch_size': 512}. Best is trial 12 with value: 0.06516007532956686.
Let's use 2 GPUs!
Epoch number:  0
0
1
2
3
4
5
6
7
8
9
10
11
12
Epoch number:  1
0
1
2
3
4
5
6
7
8
9
10
11
12
Epoch number:  2
0
1
2
3
4
5
6
7
8
9
10
11
12
Epoch number:  3
0
1
2
3
4
5
6
7
8
9
10
11
12
Epoch number:  4
0
1
2
3
4
5
6
7
8
9
10
11
12
[I 2025-07-16 18:27:15,810] Trial 15 finished with value: 0.18493408662900188 and parameters: {'lr': 0.00040488628492683085, 'weight_decay': 5.208078923846034e-06, 'optimizer': 'Adam', 'batch_size': 512}. Best is trial 15 with value: 0.18493408662900188.
Let's use 2 GPUs!
Epoch number:  0
0
1
2
3
4
5
6
7
8
9
10
11
12
Epoch number:  1
0
1
2
3
4
5
6
7
8
9
10
11
12
Epoch number:  2
0
1
2
3
4
5
6
7
8
9
10
11
12
Epoch number:  3
0
1
2
3
4
5
6
7
8
9
10
11
12
Epoch number:  4
0
1
2
3
4
5
6
7
8
9
10
11
12
[I 2025-07-16 18:31:57,595] Trial 16 finished with value: 0.1743879472693032 and parameters: {'lr': 0.0007499339636501678, 'weight_decay': 5.89811983874457e-06, 'optimizer': 'Adam', 'batch_size': 512}. Best is trial 15 with value: 0.18493408662900188.
Let's use 2 GPUs!
Epoch number:  0
0
1
2
3
4
5
6
7
8
9
10
11
12
13
14
15
16
17
18
19
20
21
22
23
24
25
26
27
28
29
30
31
32
33
34
35
36
37
38
39
40
41
42
43
44
45
46
47
48
49
50
51
52
53
54
55
56
57
58
59
60
61
62
63
64
65
66
67
68
69
70
71
72
73
74
75
76
77
78
79
80
81
82
83
84
85
86
87
88
89
90
91
92
93
94
95
96
Epoch number:  1
0
1
2
3
4
5
6
7
8
9
10
11
12
13
14
15
16
17
18
19
20
21
22
23
24
25
26
27
28
29
30
31
32
33
34
35
36
37
38
39
40
41
42
43
44
45
46
47
48
49
50
51
52
53
54
55
56
57
58
59
60
61
62
63
64
65
66
67
68
69
70
71
72
73
74
75
76
77
78
79
80
81
82
83
84
85
86
87
88
89
90
91
92
93
94
95
96
[I 2025-07-16 18:33:57,734] Trial 17 pruned. 
Let's use 2 GPUs!
Epoch number:  0
0
1
2
3
4
5
6
7
8
9
10
11
12
13
14
15
16
17
18
19
20
21
22
23
24
25
26
27
28
29
30
31
32
33
34
35
36
37
38
39
40
41
42
43
44
45
46
47
48
49
50
51
52
53
54
55
56
57
58
59
60
61
62
63
64
65
66
67
68
69
70
71
72
73
74
75
76
77
78
79
80
81
82
83
84
85
86
87
88
89
90
91
92
93
94
95
96
97
98
99
100
101
102
103
104
105
106
107
108
109
110
111
112
113
114
115
116
117
118
119
120
121
122
123
124
125
126
127
128
129
130
131
132
133
134
135
136
137
138
139
140
141
142
143
144
145
146
147
148
149
150
151
152
153
154
155
156
157
158
159
160
161
162
163
164
165
166
167
168
169
170
171
172
173
174
175
176
177
178
179
180
181
182
183
184
185
186
187
188
189
190
191
192
193
Epoch number:  1
0
1
2
3
4
5
6
7
8
9
10
11
12
13
14
15
16
17
18
19
20
21
22
23
24
25
26
27
28
29
30
31
32
33
34
35
36
37
38
39
40
41
42
43
44
45
46
47
48
49
50
51
52
53
54
55
56
57
58
59
60
61
62
63
64
65
66
67
68
69
70
71
72
73
74
75
76
77
78
79
80
81
82
83
84
85
86
87
88
89
90
91
92
93
94
95
96
97
98
99
100
101
102
103
104
105
106
107
108
109
110
111
112
113
114
115
116
117
118
119
120
121
122
123
124
125
126
127
128
129
130
131
132
133
134
135
136
137
138
139
140
141
142
143
144
145
146
147
148
149
150
151
152
153
154
155
156
157
158
159
160
161
162
163
164
165
166
167
168
169
170
171
172
173
174
175
176
177
178
179
180
181
182
183
184
185
186
187
188
189
190
191
192
193
[I 2025-07-16 18:36:03,103] Trial 18 pruned. 
Let's use 2 GPUs!
Epoch number:  0
0
1
2
3
4
5
6
7
8
9
10
11
12
Epoch number:  1
0
1
2
3
4
5
6
7
8
9
10
11
12
[I 2025-07-16 18:37:56,808] Trial 19 pruned. 
Best trial:
  Accuracy: 0.1849
  Best hyperparameters:
    lr: 0.00040488628492683085
    weight_decay: 5.208078923846034e-06
    optimizer: Adam
    batch_size: 512